"tag","text"
"real","#PutinDead Putin unfortunately not dead, although weasel&amp; woodpecker may have been shot!! http://t.co/tEvNfwohD3 "
"real","This is why it’s impossible for the #Kremlin to lie about #Putin’s weird disappearance #putindead #putinmissing http://t.co/eQacAOZfd4 "
"real","Putin's Weird Disappearance | http://t.co/w8wWhAaqN7 | #PutinDead #Russia #WhereIsPutin "
"real","While staring at yr feed for latest #Putin coup rumor listen to new SRB podcast! #Crimea annex, WWI &amp; Rus empire http://t.co/exbbJXZsu3 "
"real","Something is rotten in the state of Russia. #putindead "
"real","We've sussed it. The Kremlin's getting ready for St Patrick's Day ;) #putinmissing #putindead http://t.co/J4aOEUv4gl "
"real","#Russia #Moscow #Kremlin today #Putin #Putindead http://t.co/rubjKPxgcN "
"real","After #Putin disappeared Russian TV no longer speaks of Hunta, DNR and LNR. What shall be next? http://t.co/KwOY6xbYYd #putinmissing "
"real","#Russia #Putin emerges, meets judge aftr 9 days; net wild w rumors &amp; jokes. http://t.co/LQwcr0a0Py via @MailOnline http://t.co/XRyhCc0Wol "
"real","#putindead Check out this.A monk in Ukr predicted on Jan28 that the Russian Empire would start collapsing on Mar.12 http://t.co/fG6QXyERVM "
"real","Where is Putin? Here is the answer! He has opened a pub on Jaffa street in Jerusalem! #putindead #Putin #putinumer http://t.co/eBhvyDTNLS "
"real","So Putin is back. He's been busy. There's been a coup, he's been dead, his girlfriend gave birth, he was riding bears etc. "
"real","#BREAKING #Russia #Moscow today #Putin #Putindead http://t.co/Wg6KyvUgJ3 "
"real","So there really were tanks/APCs moving on Moscow. Not because #PutinMissing, but for Monday #Crimea bash (via @aavst) http://t.co/s0ZLzL2ckr "
"real","#Russia prepares for a military parade in #Moscow marking 1 y anniversary of #Crimea occupation. #putindead http://t.co/wEtHVvXk2S "
"real","#Putindead? Charges Against Activist Who Warned of #Russia Troops in #Ukraine Dropped http://t.co/F4Mf3AiDKZ #Putin http://t.co/GwZ81eaXlD "
"real","Read this to understand why everyone is freaking out about #putindead: http://t.co/rYMgQ1VnZt "
"real","I have a feeling Putin will reappear and declare full-scale war against Ukraine from Red Square tomorrow #putin #putindead "
"real","Putin has obviously disappeared to binge watch the entire season 3 of House of Cards.. #putinmissing #putin "
"real","Vlad just tried to slip away to attend Burning Man in peace: http://t.co/LYhLtadCKa v "
"real","Yea, I went out with him about a week ago. Why? #WhereIsPutin #Putin #putindead http://t.co/IOdJU96EVj "
"real","#Putin In our era of hybrid warfare, why not a hybrid coup? http://t.co/2nWrPTaR9w "
"real","#PutinDead is nothing more than an #American wet dream. "
"real","There he is!! #Putin #putinmissing http://t.co/EuXDTQxoyy "
"real","Why do I see tanks in front of Moscow Mayor's office? #putinmissing "
"real","You know strange things are happening in the #Kremlin when #Russia trolls start worrying #Putindead #Putin #Ukraine http://t.co/ScvTRE7zOw "
"real","Tanks in Moscow, no tanks in #Moscow, #Putindead, putin not dead, Kabayeva gave birth, Kabayeva was't pregnant. Too much speculations. Night "
"real","#Putin a person with so much power in his hands a cold can cause a national panic http://t.co/1clCLvUHyz #putindead http://t.co/0Z0vZl5mbb "
"real","What's going on in Russia? Coup, sudden illness or other ? http://t.co/bcQcVHLARB "
"real","Proof of the Russian palace coup: Putin forced to live in a doghouse outside the Kremlin http://t.co/kgJDTcqQ9P "
"real","HE'S BAAAACK!!!!!!! Putin reappears on television as rumors of his death &amp; love child spread http://t.co/68TUaI04cC http://t.co/myvG6xGZa9 "
"real","Rumors Over Vladimir Putin, Moscow Leadership Abound http://t.co/pJw6dtWbGz via @epochtimes "
"real","World: #WhereIsPutin #putindead #Kremlin #FreeSavchenko Putin: Aww, they miss me! "
"real","Radical Forces Of A Big Blood To Take Over #Russia As #Putin Coup Rumors Fly Wildly! #VladimirPutin http://t.co/ZuHI0hpsKE "
"real","#PutinMissing and Google won't search for #Putin because it knows you don't find Putin, he finds you. "
"real","I wonder when Brian Williams and Bill O'Reilly plan to tell us they took out Putin? #putindead "
"real","@Conflict_Report @DajeyPetros 'While at Kremlin I just had to peek in casket' or '#Putin's last selfie' #putindead http://t.co/udZiOLpcT4 "
"real","@fatimatlis: The silence of those who know seems much more telling than the words of those who guess - #putindead "
"real","Our QOTD: Where do you think #Putin has gone? @PaulineChiou @CNBCWorld #putinmissing "
"real","Maybe we should ask some kids who are really, really good at spotting the red striped cap. #putinmissing http://t.co/eg8vL1GTqh "
"real","Where are you #Putin? Are you dead❓😐 *awkward silence* 😅 #PutinMissing #PutinDead "
"real","Looks like Obama outmaneuvered Putin, forcing him to overreach and fall. #putinmissing #putindead http://t.co/oZhOxUBXlQ via @dailykos "
"real","Putin in film on Crimea: ‘American friends’ are real masterminds behind Ukraine coup http://t.co/IxDYZA6683 http://t.co/Mre8u82ZLc "
"real","#Putinmissing - just found him! #SundayFunday #VladimirPutin #Putin #putinnotdead http://t.co/FI9k9cKq7I http://t.co/HseiwTft5J "
"real","There was no coup in #Ukraine, #Putin now admits he was the one who urged Yanukovych to flee the country. http://t.co/Zx6ZaC5osy "
"real","Number 1 question now on Twitter and Facebook were is #Putin is #putindead #putinmissing http://t.co/VFKU479e7K "
"real","Putin in film on Crimea: US masterminds behind Ukraine coup, helped train radicals http://t.co/FJ4ozephUg "
"real","World waits to see if Putin turns up http://t.co/0fsjYnbWye #russia #putin #coup "
"real","Mostly only Canadians will get this one. lol#Putin #PutinMissing #PutinDead http://t.co/rjKz9RFmdK "
"fake","#Putin/s death or another #maskirovka? Military helo's flying over #Moscow &gt; http://t.co/Spj2VTdlAt #Reddit #Russia #Putindead #NATO "
"fake","Don't know if #putindead is true but trying to start WW3 surely puts a price on one's head. "
"fake","Is Putin facing palace coup? http://t.co/FOGZjRrDoZ "
"fake","Putin umer or Putin has died, is now trending on the Russian Internet. @LToddWood #putindead "
"fake","Is Putin facing palace coup? http://t.co/FOGZjRJegx "
"fake","#putindead #putin Can Putin's Absence Indicate A Palace Coup In Moscow? http://t.co/ImBuKEacO1 via @forbes "
"fake","Can Putin's Absence Indicate A Palace Coup In Moscow? #europe #russia http://t.co/ygSgrQBvXv via @forbes "
"fake","Can Putin's Absence Indicate A Palace Coup In Moscow? http://t.co/y9qchRg3u0 #Leadership #Forbes "
"fake","Can #Putin's Absence Indicate A Palace Coup In Moscow? http://t.co/3LQqW2fkNB #Russia "
"fake","Can Putin's Absence Indicate A Palace Coup In Moscow http://t.co/GmEq0iV1W8 "
"fake","Coup in #Russia? Good article by @Forbes. http://t.co/aaNCpb0blW #RamzanKadyrov #Putin #putindead http://t.co/OfivdTlTbO "
"fake","Rumors in Switzerland: Putin absence due to his girlfriend Alina Kabaeva giving birth in Ticino https://t.co/lBNIFEmzrW cc @russian_market "
"fake","Hoppla! @L0gg0l: Swiss Rumors: Putin absence due to girlfriend Alina giving birth in Ticino http://t.co/vZnGDH1Qys http://t.co/5TvXSdvd1H "
"fake","Lūk tā RT @L0gg0l: Rumors in Switzerland: Putin absence due to his girlfriend Alina Kabaeva giving birth in Ticino https://t.co/TYeC8ylhxq "
"fake",".@KristinaSyk the latest...via @russian_market MT Putin absence due to girlfriend giving birth http://t.co/TdOhhuy3XH http://t.co/hRqXb1r0mb "
"fake","Putin's son born today? &gt;&gt; http://t.co/RLN25tys2E via @AnnetteLatour "
"fake","This appears to be the original source of the Putin/Kabayeva/Swiss clinic rumour http://t.co/bKfJTSGdca "
"fake","Russian President Vladimir Putin to be 'ousted in coup' as rumours swirl over ill-health http://t.co/8UrQdH7v5N http://t.co/6NpJ6h4EiB "
"fake","Is Putin in Switzerland with Kabayeva? I'm skeptical @StrebelLuca @BBCDanielS http://t.co/Hcax5bZoNo "
"fake","According to this article http://t.co/pWZaRxHypA #Putin might be AWOL due to his gf giving birth in Ticino. "
"fake","Maybe Putin has just been on paternity leave? - @Blickch says Kabaeva has checked into a Swiss clinic to give birth http://t.co/gGDSkFJxdg "
"fake","@Victoriaokane @BlissTabithaCAN PUTIN'S ABSENCE INDICATE A PALACE COUP IN MOSCOW? - Forbes http://t.co/CNjygFMDRM #SmartNews #DAVICTABN "
"fake","And you thought it was Putin's back? Alina Kabaeva allegedly gave birth to a child in Switzerland. http://t.co/HlE4XxoI4S "
"fake","Has Putin Fallen Ill, or Fallen to a Coup? http://t.co/eNRAQ2a7hd "
"fake","Rumors in Ticino/Switzerland: Putin's baby already born? cc: @russian_market http://t.co/Txbcd81G1C http://t.co/0xxnb13wdX "
"fake","#PutinDead speculation really like old times http://t.co/f8Zv0jwPCj when West speculated on health of Soviet leaders http://t.co/HNb5k34WKi "
"fake","Well, this might explain everything: Kabayeva rumoured to have delivered a baby in Switzerland http://t.co/JpjmxLF4LG GER#Putin "
"fake","RT @L0gg0l: Rumors in Switzerland: #Putin absence due to his girlfriend Alina Kabaeva giving birth in Ticino http://t.co/lPUUfZRBIn "
"fake","Putin is our baby! http://t.co/TesNY8w3CN "
"fake","Swiss tabloid drops this about: Putin secret baby mission in Ticino http://t.co/zfEayq07I5 http://t.co/S7ri70b66G "
"fake","RUMORS about #Putin started with a stroke, then he's sick, and now this http://t.co/yHU98WAdxQ What's next... #Russia #cdnpoli #dirtydeeds "
"fake","After their exclusives on Putin and Kabayeva's first two babies, Page Six must be mad at getting scooped on the third http://t.co/8fKIjzW8dw "
"fake","NEWEST #Putin rumour, his girlfriend just gave birth to their child http://t.co/Qsyra1pslL #cdnpoli #Russia "
"fake","Who's the daddy? One explanation for #Putin's absence. His 32 year old girlfriend checked into Swiss maternity unit. http://t.co/ln7dqQN8z6 "
"fake","Punk may be dead – but never #Putin!#putindead http://t.co/QyuAKBaKgP "
"fake","Update: Is it a girl? #Putin cc: @russian_market http://t.co/Txbcd81G1C http://t.co/P1epNNz2Yn "
"fake","Russian President Vladimir Putin to be 'ousted in coup' as rumours swirl over ill-health http://t.co/hHf7uFn5pY "
"fake","I spend a lot of time in Ticino. Kinda offended Putin never even said hello. http://t.co/eoQKbwCpGR "
"fake","@FSwissmartini @GolinehAtai Little doubt putin &amp; his mistress were last week in Lugano &amp; gave birth to a daughter!http://t.co/qMsArnyZVE "
"fake","Is this how a coup against Vladimir Putin might happen?http://t.co/KfX47MIk0p "
"real","88-year-old Creola Mccalister has joined the youth in #Ferguson http://t.co/dfDid2xV8X http://t.co/potRilWqvb "
"real","Hands up! Don't shoot! #ferguson https://t.co/svCE1S0Zek "
"real","Not a cop in sight at the #MichaelBrown rally and all is peaceful. #ferguson "
"real","Remember: This is how #Ferguson protests began.Before dogs, tear gas, rubber bullets, intimidation, No-Fly Zone... http://t.co/i43EVto9nc "
"real","Anonymous hacking group threatens #Ferguson police in wake of Shooting http://t.co/wNjBvxk6MU http://t.co/Vrwv1EdRhM via @BET "
"real","The #Ferguson police have NOT interviewed the primary eye witness to Michael Brown's murder &amp; they won't release how many times he was shot. "
"real","The world now knows his name, tonight get to know Mike Brown the person @fox2now at 9 #ferguson http://t.co/jBNenRkexL "
"real","Wow. From responses, it seems people only know about what's happening in #Ferguson from web. What happens when gov ends net neutrality? "
"real","Next up on Fox News: Here's some footage of angry black people in #Ferguson with no discussion about why they're angry. Enjoy!#MikeBrown "
"real","And They Call #Conservatives Terrorists?#tcot #Ferguson http://t.co/NTpxGviqLB "
"real","There's a town that's a no-fly-zone with a media blackout right in the middle of our country. Let that sink in. #Ferguson "
"real","Quiet where I am. Lots of talking. Lots of standing. No smash-smash. #Ferguson http://t.co/dXiIc5EQqq "
"real","Destruction of property and destruction of life are false equivalents. #MikeBrown #Ferguson "
"real","Something being talked about tonight is the makeup of the #Ferguson Police Dept. Here's a breakdown: #MichaelBrown http://t.co/gYd5qgJh5M "
"real","Love. #ferguson https://t.co/CKUpWXYjkC "
"real","NO VIOLENCE! JUST JUSTICE! #ferguson https://t.co/3R6rTtmvzW "
"real","White twitter doing what they do best... #Ferguson #FergusonShooting http://t.co/Ks2YLkYmEJ "
"real","This isn't a riot story. My latest, on why the hands up/don't shoot protest is so important in St. Louis: http://t.co/VjJlU4Y2Fe #Ferguson "
"real","The occasional police car drives through and some shouts of F-ck the Police! can be heard. But back to peaceful when they leave. #Ferguson "
"real","A Great Grandmother in #Ferguson came out &amp; stood with the young for #MikeBrown. This is our city. http://t.co/liKmCfhQ9b "
"real","#STL A cleanup for #Ferguson has been organized. TOMORROW. Meet at 10 am Wednesday August 13, 333 N Florissant Rd, Ferguson, MO 63135 "
"real","Two weeks before #MichaelBrown was killed he accepted Jesus Christ as his savior! #Ferguson "
"real","Keep #dontshoot going! That's the chant of our young people in #Ferguson! http://t.co/CBFBGd63TM "
"real","This is #Ferguson, a suburb in America. http://t.co/GfmHLo4u5q "
"real","MT @KLynnTrice #Ferguson #FergusonShooting #MikeBrown http://t.co/ucqMi2JLxd. Best tweet of the day for me. "
"real","#BREAKING: A man just advanced on police. A red laser immediately was painted on his shirt. He threw his hands up. #Ferguson #MichaelBrown "
"real","#Ferguson picture from earlier in the day, high powered rifles trained on protesters http://t.co/OYOur3ZCrA "
"real","When white folks start discussing how POC should respond to blatant or covert racism &amp; oppression. -_- #Ferguson http://t.co/bjqZDZFOCY "
"real","Putting out a specific call again: this story should be told by Black youth, from #Ferguson. If that's you, we have a platform, get at me "
"real","Cops warn the crowd. The photog's gas mask comes out. Someone is chanting Gaza Strip. #Ferguson http://t.co/IWJkOg8oy4 "
"real","This is what the front line looks and sounds like. #Ferguson http://t.co/oIv0daVU8N "
"real","Protestor on bull horn: Is this the Gaza Strip you bombin' #Ferguson http://t.co/rsPzBuPYb1 "
"real","The #Ferguson police look more militarized now than the actual National Guard, here from the 1967 Newark riots: http://t.co/HupsfEWbIJ "
"real","Police told protesters to get out of street, they instead got on knees and said, Hands up! Don't shoot! #Ferguson http://t.co/XFpEsXBwM3 "
"real","Right now in #ferguson https://t.co/M0yp0a2Wwv "
"real","Crowd of about 250 ignoring order to disperse from W Florissant. #ferguson https://t.co/XsS38XIGPe "
"real","Officer ran up and I told him I was lost...didn't care. He cursed me out and called me a bitch. Pulled his gun out... #MikeBrown #Ferguson "
"real","I instantly broke down crying and scared for my own life. These officers do NOT care about me...or anyone black #Ferguson #MikeBrown "
"real","#Ferguson. Beware of violent street gangs in #ferguson. Here's what they look like. http://t.co/aAmfSnkQ3Z "
"real","Wherein a bunch of guys who served in Iraq and Afgh look at the #ferguson cops and say: WTF? http://t.co/moUOH56BJl via @BI_Defense "
"real","BREAKING: Instead of dispersing, protesters got on their knees with their hands up. http://t.co/mvPftWrnEs #Ferguson "
"real","When police are militarized, they go to war with citizens. #Ferguson http://t.co/WHMDzIegv1 "
"real","Crowd peacefully dispersing at the QT tonight. #Ferguson "
"real","This is Rashaen Aldrige, 20. We're here to support the family, to let them know we have their back. #Ferguson http://t.co/DECQ2VzS6Y "
"real","Protest ending for the night. #ferguson https://t.co/wIf4bkrfEc "
"real","Missouri Mayor: Looters came from out of town. http://t.co/hv3mPdHtKC … Was he talking about Sharpton? http://t.co/qS4wm2BdsK #Ferguson "
"real","Do u know how powerful it is 4 blk ppl to be able to tell their OWN stories in the face of oppression?! That's what's happening in #Ferguson "
"real","These pro-Israel protesters with rifles in ATL werent ever approached by cops. It helps to be white #Ferguson http://t.co/0sDqDmJz8q "
"real","Slow parade of cars and walkers leaving #Ferguson tonight. Peacefully. ✌️ http://t.co/FL5TKqmDW8 "
"real","A cleanup for #Ferguson has been organized. TOMORROW. Meet at 10 am Wednesday August 13, 333 N Florissant Rd, Ferguson, MO 63135 #MikeBrown "
"real","#Ferguson crowd gone, crowd showed restraint, chanted &amp; yelled at police then left, scene now empty, only media here http://t.co/Tu2LrnSG6c "
"real","A white man in Dallas set a fire, lured firefighters to the scene, shot 15 rounds at them last night...still alive. #Ferguson "
"real","To protect and serve has become To harass and shoot #Ferguson "
"real","Prayers for #Ferguson. "
"real","St. Louis Co police confirm female shot in head in 1300 bl Highmont, near QT. Appears to be drive-by shooting. #ferguson "
"real","Protestors in #Ferguson refuse to move, have put their hands up in front of police. #MikeBrown http://t.co/9TyLGy5cRU "
"real","This is not Kiev, Ukraine. This is #Ferguson, Missouri right now. http://t.co/RXZ0xkaBrP "
"real","Wow...A man picks up burning tear gas can and throws it back at police. #ferguson pic by @kodacohen @stltoday http://t.co/SASXU1yF3E "
"real","Chambers and W. Florissant right now. #Ferguson http://t.co/fLag6Sw0MU "
"real","My friend Torey just said ALL his local news channels have been blacked out too. OMG #Ferguson this is why there is a No Fly Zone order!! "
"real","Arrest being made. Chambers and W. Florissant right now. #Ferguson http://t.co/plnA4OS2IY "
"real","St. Louis County police tell me woman shot in the head and that a Lt. on scene said she's alert and gonna live. #Ferguson "
"real","A witness describes the use of tear gas tonight. #Ferguson http://t.co/B6vi7M10ck "
"real","No-fly zones, military police, teargas, censorship, machine guns. In response to the murder of an innocent kid. We're fucked. #Ferguson. "
"real","Police fire tear gas at protestors for the third night in a row in Ferguson, Mo. #Ferguson #MikeBrown http://t.co/BEoZT5yjkU "
"real","Tanks. Military police. Occupation. Media blackout. No fly zone. In...a suburb. This is America in 2014. #Ferguson "
"real","RT @PDPJ: #Ferguson picture from earlier in the day, high powered rifles trained on protesters http://t.co/qUkG9ztaQt "
"real","It's helicopters flying in #Ferguson. How a drive by happen and y'all ain't spot it??! With West Florissant COMPLETELY BLOCKED OFF. "
"real","As all eyes r on the police murder of #MikeBrown in #Ferguson, 3 more unarmed Americans killed by police in LA, Dallas &amp; Tulsa in past week. "
"real","PHOTOS:: #Ferguson, Missouri, looks like a war zone http://t.co/wXClUFvfXH http://t.co/X0ScvTtUA2 "
"real","All police officers in America should immediately be equipped with body cameras #Ferguson #PoliceState http://t.co/zsuFqz08Ev "
"real","GOD BLESS YOU #Ferguson RT @Daaance_Ki: Howard family pray for our own @SpookPacShakur . http://t.co/fW2CJgno6A "
"real","Going 2 War With Americans #Ferguson http://t.co/HOHFomjgPp "
"real","RETWEET!!! Before any cops were called, before anyone knew he was killed! One of them is his killer #ferguson http://t.co/MGqiSoj1Ab "
"real","PLEASE DONT TRY TO BUY ME OUT, MONEY OR ANYTHING. MY STORY IS FOR JUSTICE. #Ferguson http://t.co/zL7bNqls22 "
"real","The revolution may not be televised, but it's being broadcast LIVE on social media...And we're watching. #Ferguson #MikeBrown "
"real","So let me get this right - cops shoot an unarmed kid then put the town under effective martial law? In the USA? In 2014? #Ferguson "
"real","Today's events in one video:http://t.co/jMcAQI1ci9#ferguson #justiceformikebrown "
"real","When #Ferguson is just a town again - not a Twitter trend or a news story - a mother will still be without her son. http://t.co/mieUXka06T "
"real","I look at this and I'm proud. The protesters tonight in #Ferguson were NONVIOLENT. #MikeBrown http://t.co/4CNAP6j31U "
"real","even in Afghanistan we never pointed our rifles at civilians there is something seriously wrong with the police in #Ferguson "
"real","Hard to ask people to obey the law when The Law kills people w/ impunity. Riots &amp; civil unrest are offsprings of corrupt system. #Ferguson "
"real","I've said it before and I'm saying it again... Who are they really afraid of again?? #Ferguson #MikeBrown http://t.co/xxZa8B0npg "
"real","The American people are the new insurgents. #ferguson #PoliceState http://t.co/iwQEwOd1gK "
"real","Damn #Ferguson #MikeBrown http://t.co/1qmphydgip "
"real","Your friendly local police department. Protect and Serve. #Ferguson http://t.co/LIUfLlnXXK "
"real","While the initial looting in #Ferguson was deplorable, it's clear the town is now the victim of a huge militarized police state exercise. "
"real","There will be no #BlackOut or Censoring The Global Community from witnessing this #HUMAN travesty #Unity #Ferguson http://t.co/LcOVHIHivD "
"real","Is that a bag of chips?! #REAL RT @GinoTheGhost: May be the dopest photo of the year #Ferguson http://t.co/ZxF3zhbjHb "
"real","Welcome to the United Police States of America. #Ferguson http://t.co/Wau7wEohv1 "
"real","No one should live in a town where militarized police point loaded weapons at unarmed citizens #Ferguson http://t.co/nk0Ugf0tpR #morningjoe "
"real","RT @manofsteele: Man picks up burning tear gas can and throws it back at police. #ferguson pic by @kodacohen http://t.co/tBIacVzMKE "
"real","RT @tabithalou: This what they not showing you on the media. These young men cleaning up after the riot. #Ferguson http://t.co/50AjPG6o3V "
"real","We don't need to stinkin' #PoliceState Americans!This must stop!.@StupidTeanuts: Going 2 War w/ Americans #Ferguson http://t.co/lo4ZQ59DHS "
"real","This image is unreal. Cops in #Ferguson dressed &amp; armed for war, confronting a lone protestor http://t.co/QpEZQ7mPXq http://t.co/UUP2oXY6qf "
"real","Slain teen had notched a hard-fought victory: A diploma http://t.co/VNpRHaxFh6 #Ferguson #MichaelBrown "
"real","Because the news outlets are blatantly LYING about #MikeBrown murder and ignoring the clear coverup and militarization of #Ferguson "
"real",".@wizkhalifa showed support for #RIPMikeBrown last night during his #STL concert http://t.co/M7OBuIL1eV #Ferguson http://t.co/8FYpZQEWUb "
"real","Photos from @PDPJ #Ferguson http://t.co/CXXG6bPHh9 "
"real","Classes started at 8am, but by 7am #MichaelBrown would be there waiting, eager http://t.co/SVaqe4vR2V #Ferguson http://t.co/P3ubd08DB8 "
"real","All of yesterday's Vines in one YouTube video. #ferguson http://t.co/Q2wUmBg5Cr "
"real","UNEASY NIGHT: St. Louis Post Dispatch's reporting on last night's clashes in #Ferguson http://t.co/wHNNo9yo3T http://t.co/OOuZIRkjpL "
"real","The Civil Rights Act is 50 years old. These two pictures were taken 50 years apart. Behold our progress. #Ferguson http://t.co/8PNn8eteO2 "
"real","Thought I was looking at a pix from Birmingham, Alabama in 1963 but nope I was looking at #Ferguson Missouri 2014 smh http://t.co/V3vuwlNBFF "
"real","The fact that while we've been focused on #Ferguson another black man was killed by cops in LA and it barely made the news says a lot. "
"real","Also, the National Association of Black Psychologists will be on-site to provide free crisis counseling to residents of #Ferguson today. "
"real","#JusticeForMikeBrown: Powerful photos from the #Ferguson police protests http://t.co/PfZ0GIAxE1 http://t.co/I4x6KRgnHE "
"real","St. Louis area police forces are less diverse than communities they serve. By the numbers - http://t.co/L0svzVrZue #Ferguson #STL "
"real","#Ferguson vs #BundyRanch See the difference? http://t.co/zKEMY38Uds "
"real","Last night in #Ferguson started with joyous hymns &amp; calls for peace. It ended with another police shooting. My latest http://t.co/ckmGk9TnWA "
"real","The police do not consist of a few bad apples, the institution itself is rotten to the core. #Ferguson "
"real","The events in #Ferguson Missouri remind us how and why America's police became so militarised http://t.co/wDnjslz0pk http://t.co/Fdr1r1KWpV "
"real","On a street in #Ferguson: Big wooden pellets &amp; aftermath, weapons used against peaceful protesters http://t.co/hma5qv8pls "
"real","Black folks deserve a more honest account of racial politics than 'it's all love, overlook color, and give peace a chance.' #Ferguson "
"real","They say we destroying our own neighborhood. We don't own nothing out here. #Ferguson http://t.co/cVqf6kYkUL "
"real","Great piece from @nytimes about the role of racial segregation in places like #Ferguson http://t.co/yPo7ifTlcc http://t.co/eE8ljLpqEZ "
"real","This is what they aren't showing you on the media. These young men cleaning up after the riot. #Ferguson http://t.co/eDH53pfQyg "
"real","A few feet from where #MichaelBrown was killed: #Ferguson http://t.co/BpMH784CFR "
"real","Armed gunmen shoot local man as part of their reign of terror in Iraq. Oops! Nope, that was police in #Ferguson. My mistake. "
"real","If Michael Brown had shot and killed a #Ferguson police officer, would his identity be kept secret for his &amp; his family's safety? "
"real","You're either furious about this or protecting your entitlement. I believe it to be this simple: #Ferguson #Trayvon http://t.co/0SDoF5zobe "
"real","People of #Ferguson: Stop #attacking our brave #heroes! -- http://t.co/DfxchWSDBM "
